,기업이름,기업공고
13,딥러닝 알고리즘 엔지니어,"('딥러닝 알고리즘 엔지니어', '“미디어 생태계는 스트리밍으로 ...”방송과 스트리밍 서비스의 경계를 구분하는 일이 어려워지고 있습니다. 스포츠, 영화는 물론이고 게임과 쇼핑까지도 스트리밍으로 소비하는 시대입니다. “서비스 경쟁전략”미디어 서비스 회사들은 차별화된 시청 경험 제공을 위해 다양한 영상처리 기술을 검토하고 있습니다. 블루닷에서는 반도체 기술과 합을 이루어 실시간 영상처리 알고리즘 개발에 도전할 딥러닝 엔지니어를 찾고 있습니다.주요업무딥러닝 기반 영상처리 알고리즘 개발    - AI 논문 서치 및 리뷰를 통한 구현 및 테스트영상처리 알고리즘 가속을 위한 시스템 반도체 IP 개발자와 협업    - 반도체 설계를 위한 뉴럴 네트워크 경량화 및 최적화(화질, 사용자원, 속도        tradeoff) 작업 수행프로덕트 출시 후 개선작업 리딩자격요건- 3년 이상 (박사 신입급 가능)- 컴퓨터비전/머신러닝/딥러닝 지식 보유 및 관련 프로젝트 수행 경험자- 영상처리 관련 프로젝트 수행 경험자 (Super resolution, Denoising, Deblurring 등)- 딥러닝 프레임워크 (e.g. Pytorch, Tensorflow 등) 개발 가능우대사항- Top Tier 컨퍼런스 및 저널 1저자 경험- 뉴럴 네트워크 경량화 및 최적화 경험 및 기술 보유- 상용화(가능) 서비스 및 제품에 탑재된 알고리즘 개발 경험혜택 및 복지• 개인장비 - 고성능 컴퓨터 or Mac 지원• 식사,간식 - 스낵바(간식,음료) 제공 및 야근식대 지원• 연차,휴가 - 자유로운 휴가, 연차 사용• 근무형태 - 자율 출근제• 건강검진 - 매년 종합검진 제공• 기타 - 4대보험 가입, 퇴직금 별도지급기술스택 ・ 툴HTMLJavaScriptPHPPythonSpring Framework')"
14,머신러닝/딥러닝 개발,"('머신러닝/딥러닝 개발', ""'KONAN'은 1999년 설립된 기술혁신 기업으로 자연어처리와 인공지능, 빅데이터와 비정형데이터를 포함하는 초대용량 문서처리기술을 통해 고객의 가치에 기여하는 인공지능 및 빅데이터 소프트웨어 전문기업입니다. Korea Natural Language Analysis의 의미를 담고 있습니다.주요업무• 대화 서비스 개발• 딥러닝 기반 NLU 개발자격요건• 학력 : 대학교졸업(4년) 이상• 경력 : 1년 이상~12년 이하   * 사세확장에 의한 채용으로 지원자 경력에 따라 채용 적극 고려예정• AI(인공지능) 관련 전공자 혹은 관련 업무 경력자• Java 프로그래밍 언어• 머신러닝/딥러닝 관련 지식을 보유하신 분우대사항• 컴퓨터공학 및 소프트웨어 관련 전공자• TensorFlow, PyTorch 등을 활용한 AI 개발 경험이 있으신 분• AWS에서 모델링 및 서빙 경험이 있으신 분• 최신 논문을 이해하고 개발에 적용할 수 있는 능력을 갖추신 분혜택 및 복지• 청년내일채움공제 / 청년재직자내일채움공제 운영• 자유로운 연차 사용, 자유 복장, 장기근속자 포상 및 휴가• OJT, 온/오프라인 교육비지원, 도서구입비 지원• 선택적 복리후생(연 110만원이상), 경조 비용&물품&휴가 지원, 생일 축하금, 명절 선물• 건강검진 비용지원, 인력 추천/ 특허 수당, 사우회 운영기술스택 ・ 툴LinuxOraclePytorchTensorflowUnreal EngineC / C++C#JavaJavaScriptPythonRESTAPI품질 관리APIHTML5CSS3품질 엔지니어링Spring FrameworkUnity3DQA 엔지니어링Spring Boot"")"
15,딥러닝 모델 SW엔지니어,"('딥러닝 모델 SW엔지니어', '■스카이오토넷은?2013년 10월 설립된 스카이오토넷은 매출액 90억원대, 사원수 70명 규모로Autonomous Mobility Platform 모빌리티를 통한 안전하고 자유로운 일상을 실현하는 차량 관제/자율주행 전문기업을 목표로 미래가 기대되는 강소기업으로 주목받고 있습니다. 국내외 유수의 글로벌 기업 및 정부, 지자체 등과 자율주행 관련 다수의 프로젝트를 성공적으로 수행하며 Sensor Fusion, 차선검출, 주행제어 등 자체 기술력을 대외적으로 인정받은 실력있는 기업입니다.주요업무[AI Vision팀] 딥러닝 모델 SW엔지니어• 부서소개AI Vision팀은 전방 객체를 인식하는 자동긴급제동장치 AEB/ ADAS 와 인공지능 기반 지능형 카메라시스템 AIV 기술 연구개발을 대표로 딥러닝 알고리즘 성능 고도화를 통해 자율주행에 한걸음 다가가고 있습니다. • 담당업무- Computer Vision 관련 DeepLearning 모델 연구/개발- 딥러닝 모델 학습- 딥러닝 모델 성능개선 / 최적화[주요 활용 스택 : Python, C++, pytorch, TensorFlow 등 ]• 채용절차서류전형 ▷ 면접전형 ▷최종합격자격요건• 학력 : 학사 이상~• 필수요건 : Python / C++ 활용 가능하신 분• 경력 : 신입가능 (딥러닝/AI/영상인식/영상처리/이미지프로세싱 관련 석사 학위자)             경력가능 (Pytorch / TensorFlow 개발 경험하신 분)우대사항• 블랙박스 플레이어 개발 경험하신 분• GPU, NPU 관련 지식 보유하신 분 우대• Linux, Git, Docker 사용 가능하신 분 우대혜택 및 복지• 4대보험 / 퇴직연금 가입• 자유로운 연차 활용• 맛있는 커피, 차류 구비• 경조휴가 / 경조사비 지원• 야근 발생 시 석식제공• 청년내일채움공제 가입지원기술스택 ・ 툴LinuxCEmbedded Linux텔레매틱스Embedded C모뎀')"
16,딥러닝 영상처리 연구 개발자,"('딥러닝 영상처리 연구 개발자', '# 포바이포(4by4 Inc.) 2017년에 설립된 포바이포는 초고화질 제작 솔루션의 기술역량을 보유하여 시각을 연구하는 비주얼 테크 기업입니다. 주된 분야로 글로벌 가전 기업의 전시, 광고, 제품 홍보용 영상 콘텐츠의 기획, 제작 서비스를 제공하며 크리에이티브한 뉴미디어 콘텐츠를 제공하고 있습니다. 독자 개발 화질개선 솔루션을 탑재한 초고화질 스톡 플랫폼 KEYCUTstock(키컷스톡) 운영과 다양한 미디어 콘텐츠를 기획, 개발하며 차세대 콘텐츠 산업을 위한 지속적 성장 발판을 마련하고, 글로벌 콘텐츠 제작사로 발돋움 하기 위한 다양한 경험을 만들어 나가고 있습니다. 포바이포와 함께 도전의 가치를 함께 나누고, 주저함 없이 앞으로 나아갈 수 있는 역량과 경험이 풍부한 인재를 모십니다.주요업무[주요업무]• 딥러닝을 이용한 영상처리(화질개선 및 영상복원) 알고리즘 연구 개발• 논문 리뷰를 통한 코드 구현 및 테스트• 딥러닝 모델 경량화 및 최적화자격요건[자격요건]• 사용기술 : Python(PyTorch, Tensorflow), C/C++• 경력 무관우대사항[우대사항]• 딥러닝 모델 프레임워크(PyTorch, Tensorflow etc)를 이용한 프로젝트 경험자• 딥러닝 모델 경량화 및 최적화 연구 개발 경험자[공통지원자격]• 성별, 나이, 학력무관• 업무에 대한 열정과 타부서와 원만한 협업을 위한 인성과 태도를 갖춘 분• 문제 해결에 있어 세심한 통찰력과 해석 능력을 가지고 있는 분• 원활한 커뮤니케이션 스킬을 보유하신 분[관련 사이트]• 블로그 : https://blog.naver.com/4by4inc• 인스타그램 : https://www.instagram.com/4by4inc혜택 및 복지[근무환경]- 월요일 출근 1pm - 퇴근 7pm  (화~금 10am-7pm)- 점심시간 12:30~13:30- 웰컴키트 제공 (후드집업, 티셔츠, 에코백, 파우치, 텀블러 등 다양한 굿즈)- 직무에 따른 최신형 장비 지원 [혜택 및 복지]- 365일 에브리데이 스낵바 운영 (다양한 음료/커피 및 간식 무제한 제공)- 인센티브제 운영 - 생일자 유급휴가 지원- 가정의달 유급휴가 지원- 종합건강검진 (가족 동반 1인)- 단체 상해보험 (개인 실비포함)- 청년내일채움공제 지원참여 - 필요시에만 야근하며 석식비, 야간교통비 지원- 그외 다양한 혜택 및 복지를 운영중입니다. :)기술스택 ・ 툴TensorflowC / C++Python')"
17,"영상처리, 컴퓨터비전/딥러닝, 병역특례 가능","('영상처리, 컴퓨터비전/딥러닝, 병역특례 가능', '큐픽스는 컴퓨터비전 및 머신러닝 기반으로 VR/AR 클라우드 솔루션을 개발하는 프롭테크 스타트업입니다.주요업무• 사진/비디오의 데이터에서 위치를 계산하는 3D Mapping 알고리즘 개발• 이미지 프로세싱을 위한 머신러닝/딥러닝 알고리즘 개발• 영상처리/딥러닝 관련 논문 리서치자격요건• C/C++, Python 사용에 능숙 하신 분• Boost, OpenCV, Eigen 라이브러리 사용 경험이 있으신 분• 3D 그래픽스에 대한 이해가 있으신 분• 선형대수, 수치해석에 대한 이해가 있으신 분우대사항• SLAM, SfM, Visual Odometry 개발 경험이 있으신 분 • 머신러닝, 딥러닝 알고리즘 개발 경험이 있으신 분• ScanData, Mesh Processing 개발 경험이 있으신 분• OpenCV 이용한 이미지프로세싱, 영상처리 개발 경험이 있으신 분혜택 및 복지채용프로세스• 서류전형 ＞ 직무테스트 ＞ 인터뷰(1차/2차) ＞ 레퍼런스체크 ＞ 채용제안혜택 및 복지큐픽스는 자율적이고 업무에 몰입할 수 있는 환경을 만들려 노력하고 있습니다.  [Work Environment]• 선택적 자율근무 (코어타임 10am - 4pm) • 재택 근무• 스톡옵션 (성과우수자)• 자율복장 • 업무 관련 필요 장비 지원 (노트북, 모니터 등)  [Quality of life & Growth]• 자기계발 또는 직무 역량 향상에 필요한 세미나, 교육, 도서구입 등 지원• 종합건강검진• 리프레시 휴가• 점심식사 지원 및 간식 & 커피 무한 제공기술스택 ・ 툴AndroidAngularJSiOSRuby on RailsPythonSwiftTypeScriptAWSC++Flutter')"
18,Deep Learning Engineer 딥러닝 엔지니어 (전문연구요원 가능),"('Deep Learning Engineer 딥러닝 엔지니어 (전문연구요원 가능)', 'We Build a World Closer Than Ever!그 어느 때 보다 더 가까워진 세상을 만들다!사진 1장과 음성 30초만으로도 디지털 휴먼 제작이 가능한딥휴먼 기술을 가진 AI Tech 스타트업 KLleon 클레온입니다.클레온은 최첨단 딥러닝 생성 기술을 이용하여, 전 세계 모든 정보를 디지털 휴먼으로 전환함으로써 언제든 실제 대화하는 듯 한 경험을 제공하는 문화를 구축하고 인간의 인지적 능력 향상 및 외로움에서 해방되는 것을 추구합니다.클레온은 고도의 딥러닝 기술을 누구나 손쉽게 즐길 수 있도록 새로운 문화적 가치를 창출하며, 당사의 기술이 좋은 방향으로 선하게 사용될 수 있도록 올바른 문화를 선도합니다. 현재 전세계 어디에서도 볼 수 없는 혁신적인 기술들을 보유하고 있으며, 15명의 카이스트 및 우수 대학의 석사, 박사 출신의 연구원들과 함께 끊임없이 연구 개발 중입니다.또한, Kaist 출신의 경희대학교 교수님과 StarGAN 저자이신 UNIST 교수님의 영입으로 기술 고도화와 사업 확장에 박차를 가하고 있습니다.실제 카카오, 현대, LG, CJ ENM 등 유수 기업들과의 협업을 통해 이미 기술력을 입증했고, 패션/뷰티, 교육, 디지털 광고, 미디어 등 다양한 분야의 산업에 실감형 콘텐츠를 적용하여 새로운 문화적 가치를 창출하고 있습니다. 탄탄한 기술력을 바탕으로 시장에서 인정받는 것은 물론이고, 우수한 능력과 멋진 인성을 겸비한 동료들이 가득한 클레온에서 함께 새로운 시대를 열어갈 NEXT 클레오너를 찾고 있습니다.본인의 분야에서 최고의 전문가를 꿈꾸는 프로 열정러에게,언제나 문이 열려있는 클레온으로 지금 지원하세요.주요업무- 딥러닝 서비스를 제공하기 위해, 딥러닝 모델을 처리 프로세스에 맞게 연동하고 API화합니다.- 딥러닝 서비스 프로파일링을 통해 병목현상을 발견하고 더 좋은 알고리즘이나 디자인을 제안합니다.- 병렬 컴퓨팅, 컴파일 언어 등 최적화로 딥러닝 서비스를 원활하게 제공합니다.※ 해당 포지션은 정규직이며, 채용 시 3개월의 수습 기간이 있습니다.＜전형 절차＞서류 전형 ＞ 1차 실무진 면접 + 역량 테스트 ＞ 2차 컬처핏 면접 ＞ 최종 합격※ 1차 면접은 역량 검증을 위한 녹화가 필수로 진행되며, 동의하시는 경우 진행이 가능합니다.※ 녹화된 영상은 최종 면접 결과 발표 이후 7일 이내 삭제됩니다.- 이력서 및 자기소개서는 자유 양식이며, 포트폴리오 혹은 github링크를 반드시 기재해주세요!- 합격여부는 모든 지원자에게 개별 안내드립니다!자격요건- 딥러닝 엔지니어 경력 2년 이상 (석사 이상 경력 인정)- Python 또는 C++ 중 하나의 언어 능숙하게 사용 가능- PyTorch, Tensorflow 등의 딥러닝 프레임워크로 이뤄진 모델 다뤄본 경험- 전문 연구원(병역 특례) 가능우대사항- 맡은 업무에 대한 책임감이 뛰어나고, 사람들에게 편의를 제공해주고자 하는 열의- 딥러닝 기반 실 서비스 개발 및 운영 경험- Ray, Dask 등 병렬처리 프레임워크 이용 경험- 컴퓨터 비전, 이미지 및 동영상 처리 등 관련 경험- RESTful API 개발 경험- 메시지 큐를 사용하여 작업 스케쥴링을 해본 경험- TensorRT 등 딥러닝 모델 경량화 경험- Triton Inference Server와 같은, 딥러닝 작업 처리 서버 구축 경험- GPU 프로그래밍이나 Multi-GPU 프로그래밍 경험혜택 및 복지• 출/퇴근 지원- 자율 출/퇴근제 (코어타임 11시-17시)- 편리한 출퇴근 (성수역 도보 5분)• 근무환경- 당신의 마음과 같이 넓은 180Cm FURSYS Desk 제공- 자유로운 영혼을 위한 자유 좌석 공간 제공- 커피 및 간식 무한 제공- R&D Center 최고 사양 GPU 서버 제공• 걱정 No! 첫날 완벽 업무 환경 제공 - 고사양 노트북 or 데스크탑- 듀얼 모니터 및 관련 장비- 모니터/노트북 받침대 - To be continue…. !!• 보상제도- 반기별 연봉 조정- 재직자 내일채움공제 5년형 가입 지원- 청년내일채움공제 가입지원- 중소기업 취업청년 소득세 감면 지원- 정규직 전원 스톡옵션 제공 [수습 기간 종료 후]- 명절(설, 추석) 상여금 지급• 휴가정책- 생일 유급휴가 1일 지급- 파격적인 경조사 제도 (든든한 경조 휴가 및 경조금)- 눈치는 NO! 자유로운 휴가 사용• 자기계발 지원- 자기계발비 (운동/학원 등록 등) 매월 지원- 품격있는 오너의 커피타임 지원: 랜덤 1:1 커피챗 프로그램- 팀 빌딩비 및 회식비 지원- 오너의 CLASS: 각종 교육 지원- 국내/외 학회 논문 게재 시, 참가비 지원- AI 해외 학회 왕복 항공비 지원• 의료/건강 정책- 건강검진대상자 기본건강검진 지원- 상비약(구급약품)기술스택 ・ 툴GitGithubReactVueJSAWSNodeJSReact Native')"
19,"Deep Learning Engineer 딥러닝 엔지니어 (계약직 1년, 전문연구요원 가능)","('Deep Learning Engineer 딥러닝 엔지니어 (계약직 1년, 전문연구요원 가능)', 'We Build a World Closer Than Ever!그 어느 때 보다 더 가까워진 세상을 만들다!사진 1장과 음성 30초만으로도 디지털 휴먼 제작이 가능한딥휴먼 기술을 가진 AI Tech 스타트업 KLleon 클레온입니다.클레온은 최첨단 딥러닝 생성 기술을 이용하여, 전 세계 모든 정보를 디지털 휴먼으로 전환함으로써 언제든 실제 대화하는 듯 한 경험을 제공하는 문화를 구축하고 인간의 인지적 능력 향상 및 외로움에서 해방되는 것을 추구합니다.클레온은 고도의 딥러닝 기술을 누구나 손쉽게 즐길 수 있도록 새로운 문화적 가치를 창출하며, 당사의 기술이 좋은 방향으로 선하게 사용될 수 있도록 올바른 문화를 선도합니다. 현재 전세계 어디에서도 볼 수 없는 혁신적인 기술들을 보유하고 있으며, 15명의 카이스트 및 우수 대학의 석사, 박사 출신의 연구원들과 함께 끊임없이 연구 개발 중입니다.또한, Kaist 출신의 경희대학교 교수님과 StarGAN 저자이신 UNIST 교수님의 영입으로 기술 고도화와 사업 확장에 박차를 가하고 있습니다.실제 카카오, 현대, LG, CJ ENM 등 유수 기업들과의 협업을 통해 이미 기술력을 입증했고, 패션/뷰티, 교육, 디지털 광고, 미디어 등 다양한 분야의 산업에 실감형 콘텐츠를 적용하여 새로운 문화적 가치를 창출하고 있습니다. 탄탄한 기술력을 바탕으로 시장에서 인정받는 것은 물론이고, 우수한 능력과 멋진 인성을 겸비한 동료들이 가득한 클레온에서 함께 새로운 시대를 열어갈 NEXT 클레오너를 찾고 있습니다.본인의 분야에서 최고의 전문가를 꿈꾸는 프로 열정러에게,언제나 문이 열려있는 클레온으로 지금 지원하세요.주요업무- 딥러닝 서비스를 제공하기 위해, 딥러닝 모델을 처리 프로세스에 맞게 연동하고 API화합니다.- 병렬 컴퓨팅 등 최적화로 딥러닝 서비스를 원활하게 제공합니다.※ 해당 포지션은 12개월 계약직이며, 채용 시 3개월의 수습 기간이 있습니다.정규직 전환이 가능합니다. ※ 전문연구요원 진행이 가능합니다.＜전형 절차＞서류 전형 ＞ 1차 실무진 면접+역량 테스트 ＞ 2차 컬처핏 면접 ＞ 최종 합격※ 1차 면접은 역량 검증을 위한 녹화가 필수로 진행되며, 동의하시는 경우 진행이 가능합니다.※ 녹화된 영상은 최종 면접 결과 발표 이후 7일 이내 삭제됩니다.- 이력서 및 자기소개서는 자유 양식이며, 포트폴리오 혹은 github링크를 반드시 기재해주세요!- 합격여부는 모든 지원자에게 개별 안내드립니다!자격요건- Python 또는 C++ 중 하나의 언어 능숙하게 사용 가능- PyTorch, Tensorflow 등의 딥러닝 프레임워크로 이뤄진 모델 다뤄본 경험- 전문 연구원(병역 특례) 가능우대사항- 맡은 업무에 대한 책임감이 뛰어나고, 사람들에게 편의를 제공해주고자 하는 열의- 딥러닝 기반 실 서비스 개발 및 운영 경험- Ray, Dask 등 병렬처리 프레임워크 이용 경험- 컴퓨터 비전, 이미지 및 동영상 처리 등 관련 경험- RESTful API 개발 경험- 메시지 큐를 사용하여 작업 스케쥴링을 해본 경험- TensorRT 등 딥러닝 모델 경량화 경험- Triton Inference Server와 같은, 딥러닝 작업 처리 서버 구축 경험혜택 및 복지• 출/퇴근 지원- 자율 출/퇴근제 (코어타임 11시-17시)- 편리한 출퇴근 (성수역 도보 5분)• 근무환경- 당신의 마음과 같이 넓은 180Cm FURSYS Desk 제공- 자유로운 영혼을 위한 자유 좌석 공간 제공- 커피 및 간식 무한 제공- R&D Center 최고 사양 GPU 서버 제공• 걱정 No! 첫날 완벽 업무 환경 제공 - 고사양 노트북 or 데스크탑- 듀얼 모니터 및 관련 장비- 모니터/노트북 받침대 - To be continue…. !!• 보상제도- 반기별 연봉 조정- 재직자 내일채움공제 5년형 가입 지원- 청년내일채움공제 가입지원- 중소기업 취업청년 소득세 감면 지원- 정규직 전원 스톡옵션 제공 [수습 기간 종료 후]- 명절(설, 추석) 상여금 지급• 휴가정책- 생일 유급휴가 1일 지급- 파격적인 경조사 제도 (든든한 경조 휴가 및 경조금)- 눈치는 NO! 자유로운 휴가 사용• 자기계발 지원- 자기계발비 (운동/학원 등록 등) 매월 지원- 품격있는 오너의 커피타임 지원: 랜덤 1:1 커피챗 프로그램- 팀 빌딩비 및 회식비 지원- 오너의 CLASS: 각종 교육 지원- 국내/외 학회 논문 게재 시, 참가비 지원- AI 해외 학회 왕복 항공비 지원• 의료/건강 정책- 건강검진대상자 기본건강검진 지원- 상비약(구급약품)기술스택 ・ 툴GitGithubReactVueJSAWSNodeJSReact Native')"
20,R&D Center AI Deep Learning Researcher AI 딥러닝 연구원 (병역특례 전문연구원 가능),"('R&D Center AI Deep Learning Researcher AI 딥러닝 연구원 (병역특례 전문연구원 가능)', 'We Build a World Closer Than Ever!그 어느 때 보다 더 가까워진 세상을 만들다!사진 1장과 음성 30초만으로도 디지털 휴먼 제작이 가능한딥휴먼 기술을 가진 AI Tech 스타트업 KLleon 클레온입니다.클레온은 최첨단 딥러닝 생성 기술을 이용하여, 전 세계 모든 정보를 디지털 휴먼으로 전환함으로써 언제든 실제 대화하는 듯 한 경험을 제공하는 문화를 구축하고 인간의 인지적 능력 향상 및 외로움에서 해방되는 것을 추구합니다.클레온은 고도의 딥러닝 기술을 누구나 손쉽게 즐길 수 있도록 새로운 문화적 가치를 창출하며, 당사의 기술이 좋은 방향으로 선하게 사용될 수 있도록 올바른 문화를 선도합니다. 현재 전세계 어디에서도 볼 수 없는 혁신적인 기술들을 보유하고 있으며, 15명의 카이스트 및 우수 대학의 석사, 박사 출신의 연구원들과 함께 끊임없이 연구 개발 중입니다.또한, Kaist 출신의 경희대학교 교수님과 StarGAN 저자이신 UNIST 교수님의 영입으로 기술 고도화와 사업 확장에 박차를 가하고 있습니다.실제 카카오, 현대, LG, CJ ENM 등 유수 기업들과의 협업을 통해 이미 기술력을 입증했고, 패션/뷰티, 교육, 디지털 광고, 미디어 등 다양한 분야의 산업에 실감형 콘텐츠를 적용하여 새로운 문화적 가치를 창출하고 있습니다. 탄탄한 기술력을 바탕으로 시장에서 인정받는 것은 물론이고, 우수한 능력과 멋진 인성을 겸비한 동료들이 가득한 클레온에서 함께 새로운 시대를 열어갈 NEXT 클레오너를 찾고 있습니다.본인의 분야에서 최고의 전문가를 꿈꾸는 프로 열정러에게,언제나 문이 열려있는 클레온으로 지금 지원하세요.주요업무• 딥러닝 네트워크 고도화    -Computer Vision        -Generative Model (Super Resolution, Latent Search, 3D Modeling, Facial Animation Generation, Body Generation, etc)        -Discriminative Model (Face Detection, Face Segmentation, Landmark Detection, etc)• 이 외 신기술 개발    -Speech & NLP        -Speech Generation (TTS, STS, etc)        -NLG (Chatbot)    - ETC        -Multimodal Model (CLIP, Lip Sync Generation, etc)        -Meta Learning (Few-shot Learning, Continual Learning, etc)1. 본 포지션의 채용 절차는 다음과 같습니다.* 서류 전형 ＞ 코딩 테스트 ＞ 1차 실무진 면접 ＞ 2차 컬처핏 면접 ＞ 최종 합격2. 이력서 제출이 필수입니다.2-1. 포트폴리오, 깃헙 주소 제출 필수입니다.3. 허위사실 기재 시 채용이 취소될 수 있습니다.자격요건• 딥러닝 경력 2년이상(석사이상 경력 인정)• Pytorch 사용 경험• 전문 연구원(병역 특례) 가능우대사항• 딥러닝 혹은 유사 분야 논문 작성 경험• 논문 해석 및 Oral Presentation 이해가능한 영어실력• 새로운 연구에 대해 적극적이고 주도적인 분• 최신 기술 트렌드를 빨리 캐치하고 적용할 수 있는 분혜택 및 복지• 출/퇴근 지원- 자율 출/퇴근제 (코어타임 11시-17시)- 편리한 출퇴근 (성수역 도보 5분)• 근무환경- 당신의 마음과 같이 넓은 180Cm FURSYS Desk 제공- 자유로운 영혼을 위한 자유 좌석 공간 제공- 커피 및 간식 무한 제공- R&D Center 최고 사양 GPU 서버 제공• 걱정 No! 첫날 완벽 업무 환경 제공 - 고사양 노트북 or 데스크탑- 듀얼 모니터 및 관련 장비- 모니터/노트북 받침대 - To be continue…. !!• 보상제도- 반기별 연봉 조정- 재직자 내일채움공제 5년형 가입 지원- 청년내일채움공제 가입지원- 중소기업 취업청년 소득세 감면 지원- 정규직 전원 스톡옵션 제공 [수습 기간 종료 후]- 명절(설, 추석) 상여금 지급• 휴가정책- 생일 유급휴가 1일 지급- 파격적인 경조사 제도 (든든한 경조 휴가 및 경조금)- 눈치는 NO! 자유로운 휴가 사용• 자기계발 지원- 자기계발비 (운동/학원 등록 등) 매월 지원- 품격있는 오너의 커피타임 지원: 랜덤 1:1 커피챗 프로그램- 팀 빌딩비 및 회식비 지원- 오너의 CLASS: 각종 교육 지원- 국내/외 학회 논문 게재 시, 참가비 지원- AI 해외 학회 왕복 항공비 지원• 의료/건강 정책- 건강검진대상자 기본건강검진 지원- 상비약(구급약품)기술스택 ・ 툴GitGithubReactVueJSAWSNodeJSReact Native')"
